{
  "approval": {
    "actor": "nilay.shah",
    "approvedAt": "2026-08-01T20:15:00Z",
    "reason": "Adopted as the active source authority for the Phase 4 inventory and replenishment bundle. P4-D15 makes the bundle the activation unit, so this is the single selection its manifest names."
  },
  "lifecycle": {
    "reasonCode": "PHASE_4_INVENTORY_REPLAY",
    "recordId": "rec_a9afdd25d5795427",
    "state": "active",
    "supersedes": "rec_8c19f580481f8cc8"
  },
  "publication": {
    "duckdbSha256": "cb75fe72920d47c82dd8458bacc05d774c99dce4b1c4da51d9403eec0d020637",
    "gateASemanticFingerprint": "38e6ce74128b77c3eac099ba0b30e62867a3ea267af13f7de14e731882080b58",
    "gateBSemanticFingerprint": "6fc5109d42e595b8f7ddaaf044874d876059a950a2c46fad0b6063fcc1704f67",
    "logicalPath": "ingestion/data/curated/run-5bf9580d18d67e36",
    "objectCount": 1549,
    "publicationSemanticFingerprint": "7d6946eff7862a4214d677af52fa73dd191858c05eaa0360a76382af90029d74",
    "sourceSnapshotId": "a92f025475f24949178526341c2c2176468620e7762d08a78925d8eaebfe98d2"
  },
  "readiness": {
    "capabilityReadiness": "ready",
    "capabilitySufficiency": "sufficient",
    "reportFingerprint": "6fc5109d42e595b8f7ddaaf044874d876059a950a2c46fad0b6063fcc1704f67"
  },
  "schemaVersion": "retail-publication-selection/v1",
  "scope": {
    "capability": "inventory_replenishment_replay",
    "environment": "local",
    "retailerId": "retailer-demo",
    "tenantId": "tenant-demo"
  },
  "selectionId": "sel_2d3c5e156bedabd4"
}
