{
  "approval": {
    "actor": "nilay.shah",
    "approvedAt": "2026-08-03T00:00:00Z",
    "reason": "Adopted as the active source authority for the replay half. With the shortfall published the mass balance closes -- the replay's own clamp stops firing entirely, 102,533 lost units to zero in india-west -- and the oracle reproduces at 0.132 and 0.338 units per cell against the same frozen 0.5 tolerance, never a relaxed one."
  },
  "lifecycle": {
    "reasonCode": "PHASE_4_STORE_SHORTFALL_PUBLISHED",
    "recordId": "rec_bf9112339d86531d",
    "state": "active",
    "supersedes": "rec_6024612768111e13"
  },
  "publication": {
    "duckdbSha256": "c624c201884353769d143996f672fbed4b9f8cba97651d2e1ce418b494cc12bb",
    "gateASemanticFingerprint": "34943ce8c8a181c05315534943704672d67a29d90e243feebdb8dca895363e27",
    "gateBSemanticFingerprint": "9c545e1afe7a5661f934a4faac03e090ca4d0716f6144af6d12bf2d5f9416c20",
    "logicalPath": "ingestion/data/curated/run-b847177c11ac724d",
    "objectCount": 1577,
    "publicationSemanticFingerprint": "e160d12a2b41b0c6dfdc37932a67618d6c99cd6aadccea99c1248c1c013f01de",
    "sourceSnapshotId": "0634b07949b495d2bc2de1598f7ca14d324150252a0e9b50704ff984704a25bd"
  },
  "readiness": {
    "capabilityReadiness": "ready",
    "capabilitySufficiency": "sufficient",
    "reportFingerprint": "9c545e1afe7a5661f934a4faac03e090ca4d0716f6144af6d12bf2d5f9416c20"
  },
  "schemaVersion": "retail-publication-selection/v1",
  "scope": {
    "capability": "inventory_replenishment_replay",
    "environment": "local",
    "retailerId": "retailer-demo",
    "tenantId": "tenant-demo"
  },
  "selectionId": "sel_12c897d6d60c9e6b"
}
