{
  "approval": {
    "actor": "gulf-onboarding/GOI-6",
    "approvedAt": "2026-08-07T12:50:17Z",
    "reason": "Gate A, Gate B, the capability mask, the publication fingerprint and the curated DuckDB hash were all derived from this run's own retained evidence rather than transcribed: Gate A e92d267c, Gate B dc31e623, publication 5e27b42d, DuckDB 8bd93fb3, 2226 curated objects."
  },
  "lifecycle": {
    "reasonCode": "HUMAN_REPIN_ADOPTION",
    "recordId": "rec_c8081da21cf8ed2a",
    "state": "approved",
    "supersedes": "rec_38a4f5da11afc4e8"
  },
  "publication": {
    "duckdbSha256": "8bd93fb3125b984e15807766e3d26035fa2d28e31ed7c5755068bf5d79b87913",
    "gateASemanticFingerprint": "e92d267c5e7c28d575736ba606bbdfee7ba58ea81136e1001e8162db888a0a41",
    "gateBSemanticFingerprint": "dc31e6232e021f948aeab6604ff06dee039b774902ec86d2d0157073f8d6be10",
    "logicalPath": "ingestion/data/curated/run-ba7e3db6cb294efe",
    "objectCount": 2226,
    "publicationSemanticFingerprint": "5e27b42dcdfedecd0d38d565c4676dab002466f670d96026d0191b60064ffc03",
    "sourceSnapshotId": "82a5a235d6cfd3bb94cb243655a63afcddeb12a5ff6113413836fbc3b98feeae"
  },
  "readiness": {
    "capabilityReadiness": "ready",
    "capabilitySufficiency": "sufficient",
    "reportFingerprint": "dc31e6232e021f948aeab6604ff06dee039b774902ec86d2d0157073f8d6be10"
  },
  "schemaVersion": "retail-publication-selection/v1",
  "scope": {
    "capability": "inventory_replenishment_current_snapshot",
    "environment": "local",
    "retailerId": "retailer-demo",
    "tenantId": "tenant-demo"
  },
  "selectionId": "sel_ade22bf91f4492a0"
}
