{
  "approval": {
    "actor": "automated/repin-policy/v1",
    "approvedAt": "2026-08-05T22:43:10Z",
    "reason": "Adopted automatically by the repin policy: no actor was supplied, so this record asserts a POLICY decision on derived evidence and not a human review. Anyone relying on it should read the facts below, not the fact that it was approved. Publication for run-adac9e85dccb56e8-r2 passed Gate A (pass) and Gate B with all three required capabilities available. Relative to the previous pin: publication fingerprint, curated DuckDB hash. Business controls present for 11 group(s) in this run's own manifest: activeSkus, asOfDate, channels, currencies, dateRange, forecastCoveragePct, fx, markets, modelAccuracyPct, stores, totalSkus."
  },
  "lifecycle": {
    "reasonCode": "AUTOMATED_REPIN_ADOPTION",
    "recordId": "rec_8aeb9a11d08e5a90",
    "state": "candidate",
    "supersedes": null
  },
  "publication": {
    "duckdbSha256": "d4af26c508285e18a7c110a03306e714fd51b21fece573f40f9f433b54bf1677",
    "gateASemanticFingerprint": "4999fa1a3152b9acfef8d0f44f66e5d9ffd422a4535ddb140f9341f0a7da1fc1",
    "gateBSemanticFingerprint": "0817812c57d1ee1acd0fa3425d645d67c84c6dcd1057096bb21d0098c8c67749",
    "logicalPath": "ingestion/data/curated/run-adac9e85dccb56e8-r2",
    "objectCount": 1302,
    "publicationSemanticFingerprint": "8e7c1f160fcd44d9d221507ff4f5323b00756c180deba0d3572afdda91a069a1",
    "sourceSnapshotId": "4c205cd1b232543bf1160c6feec5caa1032b754ab2f74ad6595910371d10073b"
  },
  "readiness": {
    "capabilityReadiness": "ready",
    "capabilitySufficiency": "sufficient",
    "reportFingerprint": "0817812c57d1ee1acd0fa3425d645d67c84c6dcd1057096bb21d0098c8c67749"
  },
  "schemaVersion": "retail-publication-selection/v1",
  "scope": {
    "capability": "demand_forecast_non_pit",
    "environment": "local",
    "retailerId": "retailer-demo",
    "tenantId": "tenant-demo"
  },
  "selectionId": "sel_40ed20a2b978154a"
}
