{
  "approval": {
    "actor": "nilay.shah",
    "approvedAt": "2026-08-03T00:00:00Z",
    "reason": "Superseded by selection sel_9d622257e81a582c over publication run-adac9e85dccb56e8. The publication this record selects resolves one lane transit for every rank-1 lane in the network, so every recommendation shares a lead time and no screen can show a spread the policy already declares. Scope: inventory_replenishment_current_snapshot."
  },
  "lifecycle": {
    "reasonCode": "PHASE_4_TIGHTENED_REPLENISHMENT",
    "recordId": "rec_a658bce545582b0a",
    "state": "superseded",
    "supersedes": "rec_98871f9c8e06db97"
  },
  "publication": {
    "duckdbSha256": "c624c201884353769d143996f672fbed4b9f8cba97651d2e1ce418b494cc12bb",
    "gateASemanticFingerprint": "34943ce8c8a181c05315534943704672d67a29d90e243feebdb8dca895363e27",
    "gateBSemanticFingerprint": "9c545e1afe7a5661f934a4faac03e090ca4d0716f6144af6d12bf2d5f9416c20",
    "logicalPath": "ingestion/data/curated/run-b847177c11ac724d",
    "objectCount": 1577,
    "publicationSemanticFingerprint": "e160d12a2b41b0c6dfdc37932a67618d6c99cd6aadccea99c1248c1c013f01de",
    "sourceSnapshotId": "0634b07949b495d2bc2de1598f7ca14d324150252a0e9b50704ff984704a25bd"
  },
  "readiness": {
    "capabilityReadiness": "ready",
    "capabilitySufficiency": "sufficient",
    "reportFingerprint": "9c545e1afe7a5661f934a4faac03e090ca4d0716f6144af6d12bf2d5f9416c20"
  },
  "schemaVersion": "retail-publication-selection/v1",
  "scope": {
    "capability": "inventory_replenishment_current_snapshot",
    "environment": "local",
    "retailerId": "retailer-demo",
    "tenantId": "tenant-demo"
  },
  "selectionId": "sel_32e72735807a08c3"
}
