{
  "approval": {
    "actor": "automated/repin-policy/v1",
    "approvedAt": "2026-08-07T19:21:46Z",
    "reason": "Superseded by selection sel_4ca5103b25207ac9 over publication run-95b856f20766c9e1-r2. Replaced as source authority by the publication for run-95b856f20766c9e1-r2. Compared with the pin this record's publication carried: publication fingerprint, curated DuckDB hash. Scope: inventory_replenishment_current_snapshot."
  },
  "lifecycle": {
    "reasonCode": "AUTOMATED_REPIN_ADOPTION",
    "recordId": "rec_d981b9bfcab8b61e",
    "state": "superseded",
    "supersedes": "rec_0727cd6dcf91cfcc"
  },
  "publication": {
    "duckdbSha256": "5b802ff1f50d4bbeef9dcd461829da982299d692c9eeaa5baec531c57898c606",
    "gateASemanticFingerprint": "9d6cd81c8510347281c4df456046af8db12f35bd8e777c5530634f4fc22a6204",
    "gateBSemanticFingerprint": "e49187f38a0dc2b95344df994186c325f794bf1924722bbb16718633d9ac9b3e",
    "logicalPath": "ingestion/data/curated/run-95b856f20766c9e1",
    "objectCount": 2273,
    "publicationSemanticFingerprint": "179f662e0d4f2af7294237b88ae26e2b60958f2b89efd819d00bcc3ded21f378",
    "sourceSnapshotId": "a88758a19e787cd2c1cbf2dde9f11b3c10360a23114726c59d56e34666407e3f"
  },
  "readiness": {
    "capabilityReadiness": "ready",
    "capabilitySufficiency": "sufficient",
    "reportFingerprint": "e49187f38a0dc2b95344df994186c325f794bf1924722bbb16718633d9ac9b3e"
  },
  "schemaVersion": "retail-publication-selection/v1",
  "scope": {
    "capability": "inventory_replenishment_current_snapshot",
    "environment": "local",
    "retailerId": "retailer-demo",
    "tenantId": "tenant-demo"
  },
  "selectionId": "sel_4a1a74bc352d9d06"
}
